{
  "$schema": "../schemas/v1/live-scenarios.schema.json",
  "schema_version": 1,
  "fixture_set_id": "briosa.client.live.v1",
  "operation_id": "file_operations.get_working_directory",
  "error_trailer": "briosa-operation-error-bin",
  "scenarios": [
    {
      "id": "ready",
      "worker_scenario": "ready",
      "watchdog_timeout": null,
      "deny_operation": false,
      "expected": {
        "grpc_status": "OK",
        "ready_for_mp": true,
        "operation_advertised": true,
        "operation_succeeded": true,
        "recovery_succeeded": false,
        "typed_error_required": false,
        "failure_kinds": []
      }
    },
    {
      "id": "unavailable",
      "worker_scenario": "disconnected",
      "watchdog_timeout": null,
      "deny_operation": false,
      "expected": {
        "grpc_status": "UNAVAILABLE",
        "ready_for_mp": false,
        "operation_advertised": true,
        "operation_succeeded": false,
        "recovery_succeeded": false,
        "typed_error_required": true,
        "failure_kinds": [
          "OPERATION_FAILURE_KIND_SPATIAL_ANALYZER_UNAVAILABLE",
          "OPERATION_FAILURE_KIND_WORKER_UNAVAILABLE"
        ]
      }
    },
    {
      "id": "policy-denied",
      "worker_scenario": "ready",
      "watchdog_timeout": null,
      "deny_operation": true,
      "expected": {
        "grpc_status": "PERMISSION_DENIED",
        "ready_for_mp": true,
        "operation_advertised": false,
        "operation_succeeded": false,
        "recovery_succeeded": false,
        "typed_error_required": true,
        "failure_kinds": [
          "OPERATION_FAILURE_KIND_POLICY_DENIED"
        ]
      }
    },
    {
      "id": "mp-failure",
      "worker_scenario": "mp-failure",
      "watchdog_timeout": null,
      "deny_operation": false,
      "expected": {
        "grpc_status": "FAILED_PRECONDITION",
        "ready_for_mp": true,
        "operation_advertised": true,
        "operation_succeeded": false,
        "recovery_succeeded": false,
        "typed_error_required": true,
        "failure_kinds": [
          "OPERATION_FAILURE_KIND_MP_FAILURE"
        ]
      }
    },
    {
      "id": "output-failure",
      "worker_scenario": "output-failure",
      "watchdog_timeout": null,
      "deny_operation": false,
      "expected": {
        "grpc_status": "DATA_LOSS",
        "ready_for_mp": true,
        "operation_advertised": true,
        "operation_succeeded": false,
        "recovery_succeeded": false,
        "typed_error_required": true,
        "failure_kinds": [
          "OPERATION_FAILURE_KIND_OUTPUT_RETRIEVAL_FAILURE"
        ]
      }
    },
    {
      "id": "deadline",
      "worker_scenario": "delay-first-execute",
      "watchdog_timeout": null,
      "deny_operation": false,
      "expected": {
        "grpc_status": "DEADLINE_EXCEEDED",
        "ready_for_mp": true,
        "operation_advertised": true,
        "operation_succeeded": false,
        "recovery_succeeded": true,
        "typed_error_required": false,
        "failure_kinds": []
      }
    },
    {
      "id": "cancellation",
      "worker_scenario": "delay-first-execute",
      "watchdog_timeout": null,
      "deny_operation": false,
      "expected": {
        "grpc_status": "CANCELLED",
        "ready_for_mp": true,
        "operation_advertised": true,
        "operation_succeeded": false,
        "recovery_succeeded": true,
        "typed_error_required": false,
        "failure_kinds": []
      }
    },
    {
      "id": "watchdog-recovery",
      "worker_scenario": "hang-first-execute",
      "watchdog_timeout": "00:00:00.250",
      "deny_operation": false,
      "expected": {
        "grpc_status": "UNAVAILABLE",
        "ready_for_mp": true,
        "operation_advertised": true,
        "operation_succeeded": false,
        "recovery_succeeded": true,
        "typed_error_required": true,
        "failure_kinds": [
          "OPERATION_FAILURE_KIND_WORKER_WATCHDOG_TIMEOUT"
        ]
      }
    },
    {
      "id": "unsupported-version",
      "worker_scenario": "ready",
      "watchdog_timeout": null,
      "deny_operation": false,
      "expected": {
        "grpc_status": "UNIMPLEMENTED",
        "ready_for_mp": true,
        "operation_advertised": true,
        "operation_succeeded": false,
        "recovery_succeeded": false,
        "typed_error_required": false,
        "failure_kinds": [
          "OPERATION_FAILURE_KIND_UNSUPPORTED"
        ]
      }
    }
  ]
}
